id,category,scope,year,public_data,full_data,summary,created_at
05573a48-8a7c-4a07-bb22-d0392362fbf9,newNamesByYear,yearly,2025,"[""Keity"",""Aurkene"",""Johsuar"",""Ulises"",""Meri"",""Jamie"",""Arlet"",""Regina"",""Aser"",""Marxel"",""Yuxin"",""Carme"",""Suzen"",""Yumara"",""Jhon""]","[""Keity"",""Aurkene"",""Johsuar"",""Ulises"",""Meri"",""Jamie"",""Arlet"",""Regina"",""Aser"",""Marxel"",""Yuxin"",""Carme"",""Suzen"",""Yumara"",""Jhon"",""Nandin"",""Biel"",""Anet"",""Thomas"",""Mamuno"",""Howard"",""Tahira"",""Martha"",""Amalur"",""Paolo"",""Marcellan"",""Jeray"",""Eshall"",""Eluxka"",""Ayrin"",""Francesca"",""Ingrid"",""Elorri"",""Nasya"",""Xare"",""Lino"",""Roma"",""Michael"",""Abu"",""Anuk"",""Iyana"",""Grace"",""Joaquin"",""Aurelio"",""Jibran"",""Judit"",""Yinuo"",""Marius"",""Mathew"",""Brithanny"",""Madai"",""Yovany"",""Weijia"",""Mari"",""Mireya"",""Chengyi"",""Hualde"",""Ilia"",""Maira"",""Aaliyah"",""Uda"",""Mariam"",""Indi"",""Livia"",""Eliott"",""Kay"",""Amaro"",""Sol"",""Tomas"",""Benjamin"",""Berkhshagai"",""Melody"",""Valeri"",""Jhoselyn"",""Leinier"",""Mayerlin"",""Yehor"",""Nahara"",""Isaura"",""Chen"",""Vania"",""Aiatana"",""Minjinsor"",""Ciana"",""Uxua"",""Mariama"",""Armelle"",""Julie"",""Teka"",""Mhairi"",""Nair"",""Salida"",""Martn"",""Leika"",""Nikko"",""Domini"",""Abbi"",""Amor"",""Uday"",""Anthony"",""Stefy"",""Jermaid"",""Martima"",""Vanesa"",""Enai"",""Shayra"",""Santhiago"",""Khloe"",""Malia"",""Aiane"",""Hosam"",""Ares"",""Samantha"",""Dakota"",""Mathiar"",""Arwa"",""Diarry"",""Lissandri"",""Yassin"",""Kabo"",""Martt"",""Uhaina"",""Heythan"",""Aizen"",""Oinar"",""Slava"",""Dievo"",""India"",""Mae"",""Juleah"",""Leiore"",""Nasry"",""Urdin"",""Guilherme"",""Kaique"",""Aleksandr"",""Asker"",""Matvii"",""Jhoshua"",""Eliam"",""Milan"",""Damian"",""Ivet"",""Tita"",""Marcus"",""Bea"",""Teres"",""Deiane"",""Llum"",""Flavio"",""Kayet"",""Ericamir"",""Kepa"",""Nell"",""Adara"",""Temuujin"",""Dulguun"",""Darko"",""Zeus"",""Damir"",""Adhara"",""Ayli"",""Mauricio"",""Ashia"",""Lauren"",""Dereck"",""Annas"",""Petra"",""Emmy"",""Miah"",""Cocinero"",""Maimouna"",""Zhoe"",""Misheel"",""Serafin"",""Klever"",""Bandera"",""Ophelia"",""Taissiya"",""Filippo"",""Stef"",""Yuste"",""Lev""]","En 2025 se introdujeron **más de cien nombres nuevos** en la participación infantil de la festividad. Entre los nombres inéditos destacan **Keity**, **Aurkene** y **Ulises**, que no figuraban en años anteriores. La cantidad y diversidad de nuevos nombres supera ampliamente a las incorporaciones registradas en 2024, lo que refuerza la tendencia de aumento sostenido en la aparición de nombres únicos desde 2019. Los datos muestran un aporte constante de novedades en el conjunto de participantes.",2025-11-10 16:32:25.668278
07234186-6f5a-4747-a286-40414ad2650e,newNamesByYear,yearly,2024,"[""Hada"",""Darek"",""Beldianu"",""Ochun"",""Analia"",""Stefanie"",""Anelkys"",""Raphael"",""Yaneth"",""Brandon"",""Moling"",""Robinson"",""Daliana"",""Thalliana"",""Linsayd""]","[""Hada"",""Darek"",""Beldianu"",""Ochun"",""Analia"",""Stefanie"",""Anelkys"",""Raphael"",""Yaneth"",""Brandon"",""Moling"",""Robinson"",""Daliana"",""Thalliana"",""Linsayd"",""Mathias"",""Olman"",""Sharik"",""Tiziana"",""Maryam"",""Yeron"",""Ihan"",""Nacor"",""Aissata"",""Catherine"",""Nahya"",""Edahi"",""Ishaq"",""Moussa"",""Mamounou"",""Lizarbe"",""Maxwell"",""Xan"",""Rigo"",""Nader"",""Klaus"",""Angelo"",""Oian"",""Gianna"",""Leydi"",""Paulina"",""Noor"",""Lohitzune"",""Eidan"",""Kupel"",""Ernesto"",""Laurence"",""Lauritz"",""Esau"",""Lorenz"",""Ureder"",""Heithan"",""Derek"",""Santino"",""Lorinc"",""Alannah"",""Francella"",""Tselmeg"",""Navea"",""Sue"",""Odet"",""Iriana"",""Yare"",""Zhenye"",""Chanel"",""Stewart"",""Rene"",""Grethel"",""Jiale"",""Marker"",""Valery"",""Zara"",""Rui"",""Daserly"",""Cloeneri"",""Thaliana"",""Amanda"",""Nil"",""Morgane"",""Junix"",""Arriet"",""Otto"",""Faith"",""Noris"",""Hiskra"",""Shirley"",""Celina"",""Nereida"",""Aquiles"",""Arion"",""Mary"",""Nikolay"",""Artur"",""Stwars"",""Muhammad"",""Daniels"",""Ansel"",""Milo"",""Agathe"",""Ayleen"",""Marharyta"",""Vladyslava"",""Xiomeld"",""Emely"",""Isis"",""Ailani"",""Elliot"",""Aric"",""Aiene"",""Bera"",""Vanessa"",""Sienna"",""Oria"",""Ximun"",""Anais"",""Mariia"",""Iare"",""Karlota"",""Hazim"",""Shara"",""Helder"",""Hao"",""Hiritarra"",""Jen"",""Mtz"",""Etor"",""Dariela"",""Maxy"",""Jack"",""Mikhail"",""Tanael"",""Day"",""Enric"",""Iratze"",""Artem"",""Izbar"",""Juliana"",""Eileen"",""Arene"",""Lidia"",""Rafa"",""Ismene"",""Simone"",""Argia"",""Abbey"",""Salman"",""Barrilen"",""Lukene"",""Mixele"",""Urketari"",""Mare"",""Jeffren"",""Yade"",""Gareth"",""Enar"",""Ella"",""Anton"",""Serafim"",""Bautista"",""Alaine"",""Ayala"",""Garoa"",""Lilly"",""Gartxot"",""Pula"",""Barril"",""Haraitz"",""Kenya"",""Megan"",""Shuri"",""Estefania"",""Nabi"",""Agueda"",""Tadei"",""Roser"",""Noha"",""Carola"",""Bernat"",""Justo"",""Ermuun"",""Lanceros"",""Alexandre"",""Namuuntsetseg"",""Tasio""]","En 2024 se incorporaron nombres como **Hada**, **Darek** y **Beldianu** entre los nuevos nombres únicos registrados en la festividad. Esta introducción amplía la diversidad respecto a 2023, año en el que nombres distintos como **Deliany**, **Andra** y **Margo** destacaron entre las novedades. El listado de 2024 presenta ejemplos variados en la participación infantil, reflejando la continuidad en la aparición de nombres inéditos dentro del evento frente a los últimos años incluidos en el histórico.",2025-11-06 17:34:04.653112
0ec50f7e-b18d-40b7-a7ef-3b6e86ce044e,namesDiversity,global,global,1950,1950,"El evento registró un total de **1.950 nombres únicos** utilizados entre 2018 y 2025. Esta cifra refleja una diversidad significativa en la elección de nombres por parte de los niños y niñas tamborreros/as a lo largo de toda la serie histórica. La variedad registrada indica que la participación ha estado marcada por una composición muy diversa, manteniéndose constante la presencia de nombres distintos durante todo el periodo analizado.",2025-11-06 17:33:59.644306
12778866-54a3-457a-8d73-6bdb383121d3,schoolsEvolution,global,global,"[{""total"":1568,""years"":[{""year"":2018,""count"":214},{""year"":2019,""count"":230},{""year"":2020,""count"":234},{""year"":2022,""count"":225},{""year"":2023,""count"":202},{""year"":2024,""count"":232},{""year"":2025,""count"":231}],""school"":""Amara Berri""},{""total"":1461,""years"":[{""year"":2018,""count"":210},{""year"":2019,""count"":210},{""year"":2020,""count"":201},{""year"":2022,""count"":222},{""year"":2023,""count"":207},{""year"":2024,""count"":201},{""year"":2025,""count"":210}],""school"":""Santo Tomas Lizeoa""},{""total"":1294,""years"":[{""year"":2018,""count"":186},{""year"":2019,""count"":188},{""year"":2020,""count"":180},{""year"":2022,""count"":190},{""year"":2023,""count"":183},{""year"":2024,""count"":184},{""year"":2025,""count"":183}],""school"":""Aldapeta María Ikastetxea""},{""total"":1283,""years"":[{""year"":2018,""count"":181},{""year"":2019,""count"":188},{""year"":2020,""count"":185},{""year"":2022,""count"":189},{""year"":2023,""count"":172},{""year"":2024,""count"":177},{""year"":2025,""count"":191}],""school"":""Sagrado Corazon Mundaiz""},{""total"":866,""years"":[{""year"":2018,""count"":122},{""year"":2019,""count"":127},{""year"":2020,""count"":103},{""year"":2022,""count"":106},{""year"":2023,""count"":190},{""year"":2024,""count"":108},{""year"":2025,""count"":110}],""school"":""Aitor Ikastola""},{""total"":861,""years"":[{""year"":2018,""count"":127},{""year"":2019,""count"":124},{""year"":2020,""count"":129},{""year"":2022,""count"":122},{""year"":2023,""count"":115},{""year"":2024,""count"":123},{""year"":2025,""count"":121}],""school"":""Zurriola Ikastola""},{""total"":814,""years"":[{""year"":2018,""count"":118},{""year"":2019,""count"":121},{""year"":2020,""count"":114},{""year"":2022,""count"":105},{""year"":2023,""count"":133},{""year"":2024,""count"":110},{""year"":2025,""count"":113}],""school"":""Deutsche Schule""},{""total"":792,""years"":[{""year"":2018,""count"":119},{""year"":2019,""count"":130},{""year"":2020,""count"":121},{""year"":2022,""count"":122},{""year"":2023,""count"":120},{""year"":2024,""count"":94},{""year"":2025,""count"":86}],""school"":""Biteri Zuhaizti Publikoa""},{""total"":762,""years"":[{""year"":2018,""count"":97},{""year"":2019,""count"":94},{""year"":2020,""count"":111},{""year"":2022,""count"":110},{""year"":2023,""count"":118},{""year"":2024,""count"":116},{""year"":2025,""count"":116}],""school"":""Mary Ward""},{""total"":733,""years"":[{""year"":2018,""count"":100},{""year"":2019,""count"":107},{""year"":2020,""count"":110},{""year"":2022,""count"":106},{""year"":2023,""count"":100},{""year"":2024,""count"":105},{""year"":2025,""count"":105}],""school"":""Ikasbide Ikastola""},{""total"":712,""years"":[{""year"":2018,""count"":111},{""year"":2019,""count"":112},{""year"":2020,""count"":100},{""year"":2022,""count"":111},{""year"":2023,""count"":94},{""year"":2024,""count"":91},{""year"":2025,""count"":93}],""school"":""Altza Herri Ikastetxea""},{""total"":705,""years"":[{""year"":2018,""count"":85},{""year"":2019,""count"":93},{""year"":2020,""count"":92},{""year"":2022,""count"":110},{""year"":2023,""count"":112},{""year"":2024,""count"":101},{""year"":2025,""count"":112}],""school"":""Orixe""},{""total"":656,""years"":[{""year"":2018,""count"":89},{""year"":2019,""count"":94},{""year"":2020,""count"":84},{""year"":2022,""count"":89},{""year"":2023,""count"":82},{""year"":2024,""count"":107},{""year"":2025,""count"":111}],""school"":""Ibai Ikastola""},{""total"":632,""years"":[{""year"":2018,""count"":90},{""year"":2019,""count"":87},{""year"":2020,""count"":89},{""year"":2022,""count"":92},{""year"":2023,""count"":91},{""year"":2024,""count"":90},{""year"":2025,""count"":93}],""school"":""Herri Ametsa""},{""total"":552,""years"":[{""year"":2018,""count"":86},{""year"":2019,""count"":78},{""year"":2020,""count"":80},{""year"":2022,""count"":76},{""year"":2023,""count"":68},{""year"":2024,""count"":86},{""year"":2025,""count"":78}],""school"":""Jakintza Ikastola""}]","[{""total"":1568,""years"":[{""year"":2018,""count"":214},{""year"":2019,""count"":230},{""year"":2020,""count"":234},{""year"":2022,""count"":225},{""year"":2023,""count"":202},{""year"":2024,""count"":232},{""year"":2025,""count"":231}],""school"":""Amara Berri""},{""total"":1461,""years"":[{""year"":2018,""count"":210},{""year"":2019,""count"":210},{""year"":2020,""count"":201},{""year"":2022,""count"":222},{""year"":2023,""count"":207},{""year"":2024,""count"":201},{""year"":2025,""count"":210}],""school"":""Santo Tomas Lizeoa""},{""total"":1294,""years"":[{""year"":2018,""count"":186},{""year"":2019,""count"":188},{""year"":2020,""count"":180},{""year"":2022,""count"":190},{""year"":2023,""count"":183},{""year"":2024,""count"":184},{""year"":2025,""count"":183}],""school"":""Aldapeta María Ikastetxea""},{""total"":1283,""years"":[{""year"":2018,""count"":181},{""year"":2019,""count"":188},{""year"":2020,""count"":185},{""year"":2022,""count"":189},{""year"":2023,""count"":172},{""year"":2024,""count"":177},{""year"":2025,""count"":191}],""school"":""Sagrado Corazon Mundaiz""},{""total"":866,""years"":[{""year"":2018,""count"":122},{""year"":2019,""count"":127},{""year"":2020,""count"":103},{""year"":2022,""count"":106},{""year"":2023,""count"":190},{""year"":2024,""count"":108},{""year"":2025,""count"":110}],""school"":""Aitor Ikastola""},{""total"":861,""years"":[{""year"":2018,""count"":127},{""year"":2019,""count"":124},{""year"":2020,""count"":129},{""year"":2022,""count"":122},{""year"":2023,""count"":115},{""year"":2024,""count"":123},{""year"":2025,""count"":121}],""school"":""Zurriola Ikastola""},{""total"":814,""years"":[{""year"":2018,""count"":118},{""year"":2019,""count"":121},{""year"":2020,""count"":114},{""year"":2022,""count"":105},{""year"":2023,""count"":133},{""year"":2024,""count"":110},{""year"":2025,""count"":113}],""school"":""Deutsche Schule""},{""total"":792,""years"":[{""year"":2018,""count"":119},{""year"":2019,""count"":130},{""year"":2020,""count"":121},{""year"":2022,""count"":122},{""year"":2023,""count"":120},{""year"":2024,""count"":94},{""year"":2025,""count"":86}],""school"":""Biteri Zuhaizti Publikoa""},{""total"":762,""years"":[{""year"":2018,""count"":97},{""year"":2019,""count"":94},{""year"":2020,""count"":111},{""year"":2022,""count"":110},{""year"":2023,""count"":118},{""year"":2024,""count"":116},{""year"":2025,""count"":116}],""school"":""Mary Ward""},{""total"":733,""years"":[{""year"":2018,""count"":100},{""year"":2019,""count"":107},{""year"":2020,""count"":110},{""year"":2022,""count"":106},{""year"":2023,""count"":100},{""year"":2024,""count"":105},{""year"":2025,""count"":105}],""school"":""Ikasbide Ikastola""},{""total"":712,""years"":[{""year"":2018,""count"":111},{""year"":2019,""count"":112},{""year"":2020,""count"":100},{""year"":2022,""count"":111},{""year"":2023,""count"":94},{""year"":2024,""count"":91},{""year"":2025,""count"":93}],""school"":""Altza Herri Ikastetxea""},{""total"":705,""years"":[{""year"":2018,""count"":85},{""year"":2019,""count"":93},{""year"":2020,""count"":92},{""year"":2022,""count"":110},{""year"":2023,""count"":112},{""year"":2024,""count"":101},{""year"":2025,""count"":112}],""school"":""Orixe""},{""total"":656,""years"":[{""year"":2018,""count"":89},{""year"":2019,""count"":94},{""year"":2020,""count"":84},{""year"":2022,""count"":89},{""year"":2023,""count"":82},{""year"":2024,""count"":107},{""year"":2025,""count"":111}],""school"":""Ibai Ikastola""},{""total"":632,""years"":[{""year"":2018,""count"":90},{""year"":2019,""count"":87},{""year"":2020,""count"":89},{""year"":2022,""count"":92},{""year"":2023,""count"":91},{""year"":2024,""count"":90},{""year"":2025,""count"":93}],""school"":""Herri Ametsa""},{""total"":552,""years"":[{""year"":2018,""count"":86},{""year"":2019,""count"":78},{""year"":2020,""count"":80},{""year"":2022,""count"":76},{""year"":2023,""count"":68},{""year"":2024,""count"":86},{""year"":2025,""count"":78}],""school"":""Jakintza Ikastola""},{""total"":537,""years"":[{""year"":2018,""count"":67},{""year"":2019,""count"":70},{""year"":2020,""count"":58},{""year"":2022,""count"":82},{""year"":2023,""count"":81},{""year"":2024,""count"":92},{""year"":2025,""count"":87}],""school"":""Maria Reina""},{""total"":486,""years"":[{""year"":2018,""count"":66},{""year"":2019,""count"":81},{""year"":2020,""count"":78},{""year"":2022,""count"":62},{""year"":2023,""count"":65},{""year"":2024,""count"":61},{""year"":2025,""count"":73}],""school"":""Harri Beri Oleta""},{""total"":485,""years"":[{""year"":2018,""count"":65},{""year"":2019,""count"":72},{""year"":2020,""count"":70},{""year"":2022,""count"":72},{""year"":2023,""count"":68},{""year"":2024,""count"":75},{""year"":2025,""count"":63}],""school"":""Herrera Ikastetxea""},{""total"":360,""years"":[{""year"":2018,""count"":53},{""year"":2019,""count"":55},{""year"":2020,""count"":57},{""year"":2022,""count"":36},{""year"":2023,""count"":47},{""year"":2024,""count"":54},{""year"":2025,""count"":58}],""school"":""Mendiola Ikastetxea""},{""total"":151,""years"":[{""year"":2018,""count"":28},{""year"":2019,""count"":25},{""year"":2020,""count"":21},{""year"":2022,""count"":13},{""year"":2023,""count"":17},{""year"":2024,""count"":28},{""year"":2025,""count"":19}],""school"":""Otras Compañias""},{""total"":1177,""years"":[{""year"":2018,""count"":181},{""year"":2019,""count"":179},{""year"":2020,""count"":201},{""year"":2023,""count"":203},{""year"":2024,""count"":209},{""year"":2025,""count"":204}],""school"":""La Salle Ikastetxea""},{""total"":1063,""years"":[{""year"":2018,""count"":177},{""year"":2019,""count"":169},{""year"":2020,""count"":178},{""year"":2023,""count"":179},{""year"":2024,""count"":181},{""year"":2025,""count"":179}],""school"":""Ekintza Ikastola""},{""total"":1037,""years"":[{""year"":2018,""count"":176},{""year"":2019,""count"":183},{""year"":2020,""count"":166},{""year"":2023,""count"":178},{""year"":2024,""count"":170},{""year"":2025,""count"":164}],""school"":""Jesuitas San Ignacio""},{""total"":924,""years"":[{""year"":2018,""count"":154},{""year"":2019,""count"":160},{""year"":2020,""count"":148},{""year"":2023,""count"":149},{""year"":2024,""count"":160},{""year"":2025,""count"":153}],""school"":""Arantzazuko Ama Ikastola""},{""total"":844,""years"":[{""year"":2018,""count"":126},{""year"":2019,""count"":138},{""year"":2020,""count"":133},{""year"":2023,""count"":136},{""year"":2024,""count"":148},{""year"":2025,""count"":163}],""school"":""San Patricio""},{""total"":731,""years"":[{""year"":2018,""count"":116},{""year"":2019,""count"":120},{""year"":2020,""count"":123},{""year"":2023,""count"":117},{""year"":2024,""count"":123},{""year"":2025,""count"":132}],""school"":""Euskal Billera""},{""total"":723,""years"":[{""year"":2018,""count"":114},{""year"":2019,""count"":121},{""year"":2020,""count"":122},{""year"":2023,""count"":123},{""year"":2024,""count"":121},{""year"":2025,""count"":122}],""school"":""The English School""},{""total"":681,""years"":[{""year"":2018,""count"":118},{""year"":2019,""count"":107},{""year"":2020,""count"":119},{""year"":2023,""count"":112},{""year"":2024,""count"":111},{""year"":2025,""count"":114}],""school"":""Erain-eskibel Ikastetxea""},{""total"":619,""years"":[{""year"":2018,""count"":128},{""year"":2019,""count"":103},{""year"":2020,""count"":116},{""year"":2022,""count"":85},{""year"":2023,""count"":78},{""year"":2024,""count"":109}],""school"":""Elaienea Ikastetxea""},{""total"":556,""years"":[{""year"":2018,""count"":96},{""year"":2019,""count"":108},{""year"":2020,""count"":90},{""year"":2023,""count"":78},{""year"":2024,""count"":94},{""year"":2025,""count"":90}],""school"":""La Asuncion""},{""total"":553,""years"":[{""year"":2018,""count"":103},{""year"":2019,""count"":105},{""year"":2020,""count"":109},{""year"":2023,""count"":78},{""year"":2024,""count"":74},{""year"":2025,""count"":84}],""school"":""La Anunciata""},{""total"":524,""years"":[{""year"":2018,""count"":80},{""year"":2019,""count"":76},{""year"":2020,""count"":75},{""year"":2023,""count"":98},{""year"":2024,""count"":99},{""year"":2025,""count"":96}],""school"":""Axular Lizeoa""},{""total"":467,""years"":[{""year"":2018,""count"":82},{""year"":2019,""count"":76},{""year"":2020,""count"":86},{""year"":2023,""count"":75},{""year"":2024,""count"":76},{""year"":2025,""count"":72}],""school"":""Salesianos Donostia""},{""total"":463,""years"":[{""year"":2018,""count"":76},{""year"":2019,""count"":77},{""year"":2020,""count"":75},{""year"":2023,""count"":79},{""year"":2024,""count"":78},{""year"":2025,""count"":78}],""school"":""La Salle San Luis""},{""total"":437,""years"":[{""year"":2018,""count"":73},{""year"":2019,""count"":77},{""year"":2020,""count"":71},{""year"":2022,""count"":73},{""year"":2023,""count"":72},{""year"":2024,""count"":71}],""school"":""Larramendi""},{""total"":429,""years"":[{""year"":2018,""count"":70},{""year"":2019,""count"":77},{""year"":2020,""count"":72},{""year"":2023,""count"":69},{""year"":2024,""count"":66},{""year"":2025,""count"":75}],""school"":""Intxaurrondo Ikastola""},{""total"":399,""years"":[{""year"":2018,""count"":62},{""year"":2019,""count"":60},{""year"":2020,""count"":66},{""year"":2023,""count"":76},{""year"":2024,""count"":72},{""year"":2025,""count"":63}],""school"":""San Jose""},{""total"":453,""years"":[{""year"":2018,""count"":117},{""year"":2019,""count"":104},{""year"":2020,""count"":70},{""year"":2023,""count"":72},{""year"":2024,""count"":90}],""school"":""Santa Teresa""},{""total"":320,""years"":[{""year"":2022,""count"":80},{""year"":2023,""count"":77},{""year"":2024,""count"":77},{""year"":2025,""count"":86}],""school"":""Amassorrain Ikastola""},{""total"":320,""years"":[{""year"":2022,""count"":57},{""year"":2023,""count"":87},{""year"":2024,""count"":90},{""year"":2025,""count"":86}],""school"":""Gaztelubide Txiki""},{""total"":523,""years"":[{""year"":2023,""count"":156},{""year"":2024,""count"":186},{""year"":2025,""count"":181}],""school"":""Kresala Txiki""},{""total"":522,""years"":[{""year"":2023,""count"":155},{""year"":2024,""count"":169},{""year"":2025,""count"":198}],""school"":""Amaratarra Txiki""},{""total"":394,""years"":[{""year"":2023,""count"":115},{""year"":2024,""count"":133},{""year"":2025,""count"":146}],""school"":""Union Artesana 150""},{""total"":266,""years"":[{""year"":2018,""count"":100},{""year"":2019,""count"":85},{""year"":2020,""count"":81}],""school"":""Nino Jesus De Praga Karmelo""},{""total"":250,""years"":[{""year"":2022,""count"":73},{""year"":2023,""count"":80},{""year"":2024,""count"":97}],""school"":""Scientia Karmelo""},{""total"":238,""years"":[{""year"":2018,""count"":80},{""year"":2019,""count"":78},{""year"":2020,""count"":80}],""school"":""Errekalde Gastronomi Elkartea""},{""total"":222,""years"":[{""year"":2018,""count"":120},{""year"":2019,""count"":102}],""school"":""Claret Ikastola""},{""total"":135,""years"":[{""year"":2025,""count"":135}],""school"":""Elaienea""},{""total"":74,""years"":[{""year"":2022,""count"":74}],""school"":""Arantzatzuko Ama Katekesia""}]","**Amara Berri** acumuló la mayor participación escolar durante el periodo, sumando **1.568 niños y niñas tamborreros/as** en la festividad entre 2018 y 2025. En el conjunto de estos años, destacan también **Santo Tomas Lizeoa** (**1.461**) y **Aldapeta María Ikastetxea** (**1.294**) por su volumen global y continuidad. La evolución por colegios muestra en general una presencia estable en los primeros puestos, con ligeras fluctuaciones y algunas incorporaciones recientes que reflejan cambios puntuales en la composición de la participación escolar. En todos los años analizados, los centros principales han mantenido cifras destacadas, asegurando una representación sólida dentro del evento.",2025-11-06 17:34:05.634618
16db87f7-abc7-41f7-942d-ed3537c8b8cc,totalParticipantsByYear,yearly,2025,"[{""year"":2025,""count"":4874}]","[{""year"":2025,""count"":4874}]","En 2025 participaron **4.874 niños y niñas tamborreros/as** en la festividad. La cifra supone un descenso respecto a los **5.039** registrados en 2024, situándose también por debajo de los **4.907** participantes contabilizados en 2023. A pesar de esta bajada, la participación global se mantiene entre los valores más altos de los últimos años analizados, mostrando una recuperación sostenida respecto a los niveles previos a 2022.",2025-11-10 16:32:24.242501
17c4cba9-a682-4678-9d3c-443905e8a9cd,totalParticipantsByYear,yearly,2024,"[{""year"":2024,""count"":5039}]","[{""year"":2024,""count"":5039}]","En 2024 la festividad contó con **5.039 niños y niñas tamborreros/as** inscritos en el evento. Esta cifra supone un incremento respecto a 2023, cuando participaron **4.907** jóvenes, y se sitúa claramente por encima de los niveles registrados entre 2018 y 2022, cuyos valores oscilaron entre **2.682** y **4.591** participantes. El crecimiento observado en 2024 consolida la recuperación de la participación infantil tras los descensos de años anteriores documentados en el histórico.",2025-11-06 17:34:03.000549
